[2m  🧠 The[0m[2m user wants me to[0m[2m complete a Todo app[0m[2m in `todo_app[0m[2m.py`. They[0m[2m mention[0m[2m that the GET endpoint[0m[2m works and[0m[2m need[0m[2m me to implement Create[0m[2m, Update, and[0m[2m Delete operations.[0m[2m I[0m[2m should[0m[2m:
     
     1. First[0m[2m, read the existing[0m[2m `todo_app.py[0m[2m` file to understand[0m[2m the current structure[0m[2m
     2. Understand[0m[2m what framework[0m[2m is being[0m[2m used (likely Flask[0m[2m or FastAPI)[0m[2m
     3. Implement the[0m[2m missing CRUD operations[0m[2m
     4. Verify[0m[2m the implementation works[0m[2m
     
     Let me start[0m[2m by reading the file[0m[2m.[0m[2m
  🧠 I'll help[0m[2m you complete the CRUD[0m[2m operations in[0m[2m the Todo[0m[2m app. Let me[0m[2m first examine the current[0m[2m implementation.[0m[2m
  🧰 call_txx161eo | read_file {'path': '/Users/gofrendigunawan/zrb ...'}[0m[2m
  🔠 call_txx161eo | Return from typing import List, Optional
     
     import uvicorn
     from fastapi import FastAPI, HTTPException
     from pydantic import BaseModel
     
     app = FastAPI()
     
     
     class TodoItem(BaseModel):
         id: int
         title: str
         completed: bool = False
     
     
     # In-memory database
     db: List[TodoItem] = [
         TodoItem(id=1, title="Buy groceries"),
         TodoItem(id=2, title="Walk the dog"),
     ]
     
     
     @app.get("/todos", response_model=List[TodoItem])
     async def get_todos():
         return db
     
     
     # TODO: Implement POST /todos to add a new item
     # TODO: Implement PUT /todos/{item_id} to update an item
     # TODO: Implement DELETE /todos/{item_id} to delete an item
     
     if __name__ == "__main__":
         uvicorn.run(app, host="0.0.0.0", port=8000)
     [0m[2m
  🧠 I[0m[2m can see the structure[0m[2m of[0m[2m the Todo[0m[2m app. It's[0m[2m a[0m[2m FastAPI application[0m[2m with:
     - A[0m[2m `TodoItem`[0m[2m model with id[0m[2m, title, and[0m[2m completed fields
     -[0m[2m An in-memory database[0m[2m ([0m[2mlist of Todo[0m[2mItem)[0m[2m
     - A working[0m[2m GET endpoint[0m[2m
     
     I need to implement[0m[2m:
     1. POST[0m[2m /todos - Create[0m[2m a new todo item[0m[2m
     2. PUT[0m[2m /todos/{item[0m[2m_id} - Update[0m[2m an existing todo item[0m[2m
     3. DELETE[0m[2m /todos/{item[0m[2m_id} - Delete[0m[2m a todo item[0m[2m
     
     For the[0m[2m POST operation[0m[2m, I need[0m[2m to:
     - Accept[0m[2m a new[0m[2m item[0m[2m (probably[0m[2m without the id,[0m[2m since we[0m[2m want auto-increment[0m[2m)
     - Find[0m[2m the next available ID[0m[2m (max existing[0m[2m +[0m[2m 1)
     -[0m[2m Add to the database[0m[2m
     - Return[0m[2m 201 Created[0m[2m
     
     For[0m[2m PUT:[0m[2m
     - Accept item[0m[2m_id in[0m[2m path
     - Accept[0m[2m update[0m[2m data ([0m[2mprobably[0m[2m all[0m[2m fields or[0m[2m partial[0m[2m)
     - Find[0m[2m the item by[0m[2m id[0m[2m
     - Update[0m[2m if[0m[2m found,[0m[2m return 404[0m[2m if not[0m[2m
     - Return 200[0m[2m OK
     
     For DELETE[0m[2m:
     - Accept[0m[2m item_id in path[0m[2m
     - Find and[0m[2m remove item[0m[2m
     - Return 40[0m[2m4 if not found[0m[2m
     - Return[0m[2m 204 No Content or[0m[2m 200 OK[0m[2m
     
     Let me implement these[0m[2m operations[0m[2m in[0m[2m the file.[0m[2m
  🧠 I'll implement[0m[2m the missing CRUD operations[0m[2m.[0m[2m Let me add the[0m[2m POST, PUT,[0m[2m and DELETE endpoints.[0m[2m
  🧰 call_uy3ij3p1 | replace_in_file {'path': '/Users/gofrendigunawan/zrb ...', 'old_text': '@app.get("/todos", respons ...', 'new_text': '@app.get("/todos", respons ...'}[0m[2m
  🔠 call_uy3ij3p1 | Return Successfully updated /Users/gofrendigunawan/zrb/llm-challenges/experiment/ollama:glm-4.7:cloud/feature/workdir/todo_app.py[0m[2m
  🧠 
     
     I[0m[2m've implemented the CRUD[0m[2m operations. Now I[0m[2m should[0m[2m verify that[0m[2m the implementation works by[0m[2m testing[0m[2m the endpoints[0m[2m. Let me create[0m[2m a test script or[0m[2m start[0m[2m the server and[0m[2m test the[0m[2m endpoints.
     
     Actually,[0m[2m let me first check[0m[2m if Fast[0m[2mAPI is available and[0m[2m then test[0m[2m the application[0m[2m.[0m[2m
  🧠 Now I[0m[2m'll verify the implementation[0m[2m by running the app[0m[2m and testing the[0m[2m endpoints with[0m[2m curl[0m[2m.[0m[2m
  🧰 call_t1l8zwu9 | run_shell_command {'command': 'python3 todo_app.py &'}[0m  [2m/bin/sh: -c: line 0: syntax error near unexpected token `;'
[0m  [2m/bin/sh: -c: line 0: `{ python3 todo_app.py & ; }; __code=$?; pgrep -g $(ps -o pgid= -p $$) > /var/folders/1s/_rqf0d4j61x67p1chkdylmb80000gp/T/zrb_pids_3a4uygof 2>/dev/null; exit $__code'
[0m[2m
  🔠 call_t1l8zwu9 | Return Command: python3 todo_app.py &
     Directory: /Users/gofrendigunawan/zrb/llm-challenges/experiment/ollama:glm-4.7:cloud/feature/workdir
     Stdout:
     (empty)
     Stderr:
     /bin/sh: -c: line 0: syntax error near unexpected token `;'
     /bin/sh: -c: line 0: `{ python3 todo_app.py & ; }; __code=$?; pgrep -g $(ps -o pgid= -p $$) > /var/folders/1s/_rqf0d4j61x67p1chkdylmb80000gp/T/zrb_pids_3a4uygof 2>/dev/null; exit $__code'
     Exit Code: 2
     Background PIDs: (none)[0m[2m
  🧠 The[0m[2m shell[0m[2m syntax[0m[2m was[0m[2m wrong. Let me[0m[2m use[0m[2m a simpler[0m[2m approach - run[0m[2m the server in the[0m[2m background properly.[0m[2m
  🧰 call_4xvfq5xv | run_shell_command {'command': 'python3 -c "import asyncio ...'}[0m  [2mTraceback (most recent call last):
[0m  [2m  File "<string>", line 1, in <module>
[0m  [2m    import asyncio; asyncio.create_task(None)
[0m  [2m                    ~~~~~~~~~~~~~~~~~~~^^^^^^
[0m  [2m  File "/Users/gofrendigunawan/.pyenv/versions/3.13.0/lib/python3.13/asyncio/tasks.py", line 407, in create_task
[0m  [2m    loop = events.get_running_loop()
[0m  [2mRuntimeError: no running event loop
[0m  [2mFastAPI check
[0m[2m
  🔠 call_4xvfq5xv | Return Command: python3 -c "import asyncio; asyncio.create_task(None)" 2>&1 || echo "FastAPI check"
     Directory: /Users/gofrendigunawan/zrb/llm-challenges/experiment/ollama:glm-4.7:cloud/feature/workdir
     Stdout:
     Traceback (most recent call last):
       File "<string>", line 1, in <module>
         import asyncio; asyncio.create_task(None)
                         ~~~~~~~~~~~~~~~~~~~^^^^^^
       File "/Users/gofrendigunawan/.pyenv/versions/3.13.0/lib/python3.13/asyncio/tasks.py", line 407, in create_task
         loop = events.get_running_loop()
     RuntimeError: no running event loop
     FastAPI check
     Stderr:
     (empty)
     Exit Code: 0
     Background PIDs: (none)[0m[2m
  🧠 
     Let me check if[0m[2m FastAPI is installed[0m[2m and then write[0m[2m a test[0m[2m script to verify the[0m[2m implementation[0m[2m works[0m[2m,[0m[2m or[0m[2m I could[0m[2m create[0m[2m a simple verification[0m[2m script that[0m[2m imports[0m[2m the app and validates[0m[2m the routes[0m[2m exist.[0m[2m
     
     Actually, let me[0m[2m create a comprehensive[0m[2m test script to[0m[2m verify the CRUD operations[0m[2m work correctly.[0m[2m
  🧰 call_1uz2os7x | write_file {'path': '/Users/gofrendigunawan/zrb ...', 'content': '#!/usr/bin/env python3\n""" ...'}[0m[2m
  🔠 call_1uz2os7x | Return Successfully wrote to /Users/gofrendigunawan/zrb/llm-challenges/experiment/ollama:glm-4.7:cloud/feature/workdir/verify_todo_app.py[0m[2m
  🧠 Now[0m[2m let me run the[0m[2m verification script to test[0m[2m all[0m[2m the CRUD operations.[0m[2m
  🧰 call_0k3pmpb2 | run_shell_command {'command': 'python3 /Users/gofrendigun ...', 'timeout': 30}[0m  [2m✓ Successfully imported FastAPI and todo_app
[0m  [2m
[0m  [2m--- Testing GET /todos (initial) ---
[0m  [2mStatus: 200
[0m  [2mInitial todos: [{'id': 1, 'title': 'Buy groceries', 'completed': False}, {'id': 2, 'title': 'Walk the dog', 'completed': False}]
[0m  [2m
[0m  [2m--- Testing POST /todos ---
[0m  [2mStatus: 201
[0m  [2mCreated: {'id': 3, 'title': 'Test new item', 'completed': False}
[0m  [2m
[0m  [2m--- Testing GET /todos (after POST) ---
[0m  [2mStatus: 200
[0m  [2mAll todos: [{'id': 1, 'title': 'Buy groceries', 'completed': False}, {'id': 2, 'title': 'Walk the dog', 'completed': False}, {'id': 3, 'title': 'Test new item', 'completed': False}]
[0m  [2m
[0m  [2m--- Testing PUT /todos/3 ---
[0m  [2mStatus: 200
[0m  [2mUpdated: {'id': 3, 'title': 'Updated title', 'completed': True}
[0m  [2m
[0m  [2m--- Testing PUT /todos/3 (partial) ---
[0m  [2mStatus: 200
[0m  [2mPartially updated: {'id': 3, 'title': 'Updated title', 'completed': False}
[0m  [2m
[0m  [2m--- After update: {'id': 3, 'title': 'Updated title', 'completed': False} ---
[0m  [2m
[0m  [2m--- Testing PUT /todos/9999 (not found) ---
[0m  [2mStatus: 404
[0m  [2m
[0m  [2m--- Testing DELETE /todos/3 ---
[0m  [2mStatus: 204
[0m  [2m
[0m  [2m--- Testing GET /todos (after DELETE) ---
[0m  [2mStatus: 200
[0m  [2mTodos after delete: [{'id': 1, 'title': 'Buy groceries', 'completed': False}, {'id': 2, 'title': 'Walk the dog', 'completed': False}]
[0m  [2m
[0m  [2m--- Testing DELETE /todos/9999 (not found) ---
[0m  [2mStatus: 404
[0m  [2m
[0m  [2m==================================================
[0m  [2m✓ ALL TESTS PASSED!
[0m[2m
  🔠 call_0k3pmpb2 | Return Command: python3 /Users/gofrendigunawan/zrb/llm-challenges/experiment/ollama:glm-4.7:cloud/feature/workdir/verify_todo_app.py
     Directory: /Users/gofrendigunawan/zrb/llm-challenges/experiment/ollama:glm-4.7:cloud/feature/workdir
     Stdout:
     ✓ Successfully imported FastAPI and todo_app
     
     --- Testing GET /todos (initial) ---
     Status: 200
     Initial todos: [{'id': 1, 'title': 'Buy groceries', 'completed': False}, {'id': 2, 'title': 'Walk the dog', 'completed': False}]
     
     --- Testing POST /todos ---
     Status: 201
     Created: {'id': 3, 'title': 'Test new item', 'completed': False}
     
     --- Testing GET /todos (after POST) ---
     Status: 200
     All todos: [{'id': 1, 'title': 'Buy groceries', 'completed': False}, {'id': 2, 'title': 'Walk the dog', 'completed': False}, {'id': 3, 'title': 'Test new item', 'completed': False}]
     
     --- Testing PUT /todos/3 ---
     Status: 200
     Updated: {'id': 3, 'title': 'Updated title', 'completed': True}
     
     --- Testing PUT /todos/3 (partial) ---
     Status: 200
     Partially updated: {'id': 3, 'title': 'Updated title', 'completed': False}
     
     --- After update: {'id': 3, 'title': 'Updated title', 'completed': False} ---
     
     --- Testing PUT /todos/9999 (not found) ---
     Status: 404
     
     --- Testing DELETE /todos/3 ---
     Status: 204
     
     --- Testing GET /todos (after DELETE) ---
     Status: 200
     Todos after delete: [{'id': 1, 'title': 'Buy groceries', 'completed': False}, {'id': 2, 'title': 'Walk the dog', 'completed': False}]
     
     --- Testing DELETE /todos/9999 (not found) ---
     Status: 404
     
     ==================================================
     ✓ ALL TESTS PASSED!
     Stderr:
     (empty)
     Exit Code: 0
     Background PIDs: (none)[0m[2m
  🧠 All[0m[2m tests passed. Let[0m[2m me clean up the[0m[2m verification script.[0m[2m
  🧰 call_tlxsyh86 | run_shell_command {'command': 'rm /Users/gofrendigunawan/ ...'}[0m[2m
  🔠 call_tlxsyh86 | Return Command: rm /Users/gofrendigunawan/zrb/llm-challenges/experiment/ollama:glm-4.7:cloud/feature/workdir/verify_todo_app.py
     Directory: /Users/gofrendigunawan/zrb/llm-challenges/experiment/ollama:glm-4.7:cloud/feature/workdir
     Stdout:
     (empty)
     Stderr:
     (empty)
     Exit Code: 0
     Background PIDs: (none)[0m[2m
  🧠 
     The[0m[2m task is complete.[0m[2m Let[0m[2m me read[0m[2m the final file[0m[2m to confirm what[0m[2m was implemented,[0m[2m and[0m[2m then provide a summary[0m[2m to[0m[2m the user.[0m[2m
  🧰 call_rx1vat77 | read_file {'path': '/Users/gofrendigunawan/zrb ...'}[0m[2m
  🔠 call_rx1vat77 | Return from typing import List, Optional
     
     import uvicorn
     from fastapi import FastAPI, HTTPException
     from pydantic import BaseModel
     
     app = FastAPI()
     
     
     class TodoItem(BaseModel):
         id: int
         title: str
         completed: bool = False
     
     
     # In-memory database
     db: List[TodoItem] = [
         TodoItem(id=1, title="Buy groceries"),
         TodoItem(id=2, title="Walk the dog"),
     ]
     
     
     @app.get("/todos", response_model=List[TodoItem])
     async def get_todos():
         return db
     
     
     # Create a new todo item
     @app.post("/todos", response_model=TodoItem, status_code=201)
     async def create_todo(title: str, completed: bool = False):
         # Auto-increment ID
         new_id = max(item.id for item in db) + 1 if db else 1
         new_todo = TodoItem(id=new_id, title=title, completed=completed)
         db.append(new_todo)
         return new_todo
     
     
     # Update an existing todo item
     @app.put("/todos/{item_id}", response_model=TodoItem)
     async def update_todo(item_id: int, title: Optional[str] = None, completed: Optional[bool] = None):
         # Find the item by id
         todo_item = next((item for item in db if item.id == item_id), None)
         
         if todo_item is None:
             raise HTTPException(status_code=404, detail="Todo item not found")
         
         # Update fields if provided
         if title is not None:
             todo_item.title = title
         if completed is not None:
             todo_item.completed = completed
         
         return todo_item
     
     
     # Delete a todo item
     @app.delete("/todos/{item_id}", status_code=204)
     async def delete_todo(item_id: int):
         # Find and remove the item by id
         todo_index = next((i for i, item in enumerate(db) if item.id == item_id), None)
         
         if todo_index is None:
             raise HTTPException(status_code=404, detail="Todo item not found")
         
         db.pop(todo_index)
         return None
     
     
     if __name__ == "__main__":
         uvicorn.run(app, host="0.0.0.0", port=8000)
     [0m[2m
  🧠 
     All[0m[2m CRUD[0m[2m operations have been implemented[0m[2m and tested successfully[0m[2m. Let[0m[2m me provide a summary[0m[2m.[0m[2m
     
     The file[0m[2m has[0m[2m the[0m[2m necessary[0m[2m CRUD[0m[2m:[0m[2m
     - POST:[0m[2m 201 Created[0m[2m
     - PUT[0m[2m ([0m[2mupdate[0m[2m): 200 OK[0m[2m
     - DELETE:[0m[2m 204 No Content[0m[2m
     All[0m[2m return[0m[2m appropriate[0m[2m status[0m[2m codes per[0m[2m the[0m[2m prompt ([0m[2mGET[0m[2m remains[0m[2m 200).[0m[2m Tests[0m[2m passed.[0m[2m
  🧠 All[0m[2m CRUD operations implemented and[0m[2m verified.[0m[2m
     
     Summary[0m[2m of changes to[0m[2m `todo_app.py[0m[2m`:[0m[2m
     
     - POST[0m[2m `/todos`:[0m[2m Creates new item with[0m[2m auto-increment ID[0m[2m →[0m[2m 201 Created[0m[2m
     - PUT[0m[2m `/todos/{item[0m[2m_id}`: Updates[0m[2m fields[0m[2m (title[0m[2m, completed[0m[2m) → 200[0m[2m OK;[0m[2m returns[0m[2m 404 if[0m[2m not found
     -[0m[2m DELETE `/todos/{[0m[2mitem_id}`:[0m[2m Deletes[0m[2m item → 204[0m[2m No Content; returns[0m[2m 404 if[0m[2m not found
     
     All[0m[2m tests passed.[0m[2m
  [2m💸 (Requests: 9 | Tool Calls: 8 | Total: 87980) Input: 85146 | Audio Input: 0 | Output: 2834 | Audio Output: 0 | Cache Read: 0 | Cache Write: 0 | Details: {}[0m
     [0m[2mTo run again:[0m [1;33mzrb chat --message "We have a half-baked Todo app in `todo_app.py`. The GET endpoint works, but we need you to finish the CRUD operations.

Please implement the functionality to Create, Update, and Delete todo items. Make sure it handles IDs correctly (auto-increment is fine) and returns standard HTTP status codes." --model ollama:glm-4.7:cloud --session "" --yolo true --attach "" --interactive false[0m
All CRUD operations implemented and verified.

Summary of changes to `todo_app.py`:

- POST `/todos`: Creates new item with auto-increment ID → 201 Created
- PUT `/todos/{item_id}`: Updates fields (title, completed) → 200 OK; returns 404 if not found
- DELETE `/todos/{item_id}`: Deletes item → 204 No Content; returns 404 if not found

All tests passed.
